objectid,parentid,title,display_template,creatorid,creator,type,format,subjectid,subject,topicid,subtopic,description,date,date_published,publisher,journal_title,language,relation,filename,object_location,image_small,image_thumb
reading_71,syllabus_12,"""Philosophy of Religion, History of"" Vol 6, pp.  276—285"" in the Encyclopedia of Philosophy: H. D. Lewis",record,scholar60,Hywei David Lewis,Image;StillImage,,subject14,Philosophy and Religion,topic36,Background reading,assigned weekly reading,1988-01-14,1967,Macmillan,,eng,"(IsPartOf): the Encyclopedia of Philosophy: H. D. Lewis, ""Philosophy of Religion, History of"" Vol 6, pp.276-285",,,,
reading_72,syllabus_12,"""Philosophy of Religion, Problems of"" Vol 6, pp. 285—289   in the Encyclopedia of Religion",record,scholar61,W.P. Alston,Image;StillImage,,subject14,Philosophy and Religion,topic36,Background reading,assigned weekly reading,1988-01-14,1968,Macmillan,,eng,"(IsPartOf): the Encyclopedia of Philosophy: H. D. Lewis, ""Philosophy of Religion, History of"" Vol 6, pp.285-289",,,,
reading_73,syllabus_12,"""Philosophy and Religion"" in the Encyclopedia of Religion",record,scholar62,J.E. Smith,Image;StillImage,,subject14,Philosophy and Religion,topic36,Background reading,assigned weekly reading,1988-01-21,,,,eng,"(IsPartOf): the Encyclopedia of Religion, J.E. Smith, ""Philosophy of Religion, History of"" Vol 11, pp.295-305",,,,
reading_74,syllabus_12,"""Philosophy of Religion"", vol. 11, pp. 305-311 vy Q. proundfoot",record,scholar63,W. Proudfoot,Image;StillImage,,subject14,Philosophy and Religion,topic36,Background reading,assigned weekly reading,1988-01-21,,,,eng,"(IsPartOf): the Encyclopedia of Religion, J.E. Smith, ""Philosophy of Religion, History of"" Vol 11, pp.295-306",,,,
reading_75,syllabus_12,An Introduction to the Philosophy of Religion,record,scholar64,William J. Abraham,Image;StillImage,,subject14,Philosophy and Religion,topic36,Background reading,assigned weekly reading,1988-01-21,1985,Prentice-Hall,,eng,,,,,
reading_76,syllabus_12,Philosophy of Religion,record,scholar65,John Hick,Image;StillImage,,subject14,Philosophy and Religion,topic36,Background reading,assigned weekly reading,1988-01-21,1983,Prentice-Hall,,eng,,,,,
reading_77,syllabus_12,chapter one and two,record,scholar65,John Hick,Image;StillImage,,subject14,Philosophy and Religion,topic37,Natural Theology ,assigned weekly reading,1988-01-21,1983,Prentice-Hall,,eng,"(IsPartOf): Philosophy of Religion. Third edition. Englewood Cliffs, Prentice Hall, 1983. ch1 and ch2",,,,
reading_78,syllabus_12,chapter three and ten,record,scholar64,William J. Abraham,Image;StillImage,,subject14,Philosophy and Religion,topic37,Natural Theology ,assigned weekly reading,1988-01-21,1985,Prentice-Hall,,eng,"(IsPartOf): An Introduction to the Philosophy of Religion,  1985. ch3 and ch10",,,,
reading_79,syllabus_12,The Five Ways: St. Thomas Aquinas' Proofs of God's Existence,record,scholar66,Anthony J Kenny,Image;StillImage,,subject14,Philosophy and Religion,topic37,Natural Theology ,assigned weekly reading,1988-01-28,1980,University of Notre Dame Press,,eng,,,,,
reading_80,syllabus_12,"Hume, Dialogues on Natural Religion, Part X and XI",record,scholar67,David Hume,Image;StillImage,,subject14,Philosophy and Religion,topic38,Philosophical Critiques of Religion,assigned weekly reading,1988-02-04,1779,Oxford University Press,,eng,,,,,
reading_81,syllabus_12," ""Religious Language"", Encyclopedia of Philosophy  7, pp. 168-174""  ",record,scholar61,W.P. Alston,Image;StillImage,,subject14,Philosophy and Religion,topic38,Philosophical Critiques of Religion,assigned weekly reading,1988-02-04,1968,Macmillan,,eng,"(IsPartOf): Religious Language"", Encyclopedia of Philosophy  7, pp. 168-174 ",,,,
reading_82,syllabus_12,"ch 2, ch 6, ch 13 of An Introduction to the Philosophy of Religion",record,scholar64,William J. Abraham,Image;StillImage,,subject14,Philosophy and Religion,topic38,Philosophical Critiques of Religion,assigned weekly reading,1988-02-04,1980,Prentice-Hall,,eng,(IsPartOf): An Introduction to the Philosophy of Religion. 1983,,,,
reading_83,syllabus_12,"ch4, ch 6, ch7 of Philosophy of Religion",record,scholar65,John Hick,Image;StillImage,,subject14,Philosophy and Religion,topic38,Philosophical Critiques of Religion,assigned weekly reading,1988-02-11,1983,Prentice-Hall,,eng,(IsPartOf): Philosophy of Religion,,,,
reading_84,syllabus_12,"ch 7, ch8 of An Introduction to the Philosophy of Religion",record,scholar64,William J. Abraham,Image;StillImage,,subject14,Philosophy and Religion,topic39,The Response of Fideism,assigned weekly reading,1988-02-11,1985,Prentice-Hall,,eng,(IsPartOf): An Introduction to the Philosophy of Religion. 1983,,,,
reading_85,syllabus_12,ch 17 of An Introduction to the Philosophy of Religion,record,scholar64,William J. Abraham,Image;StillImage,,subject14,Philosophy and Religion,topic40,Religion and Immortality,assigned weekly reading,1988-02-11,1985,Prentice-Hall,,eng,(IsPartOf): An Introduction to the Philosophy of Religion. 1983,,,,
reading_86,syllabus_12,"ch 9, ch 10 of Philosophy of Religion",record,scholar65,John Hick,Image;StillImage,,subject14,Philosophy and Religion,topic40,Religion and Immortality,assigned weekly reading,1988-02-11,1983,Prentice-Hall,,eng,(IsPartOf): Philosophy of Religion,,,,
talk_1,,Discover the Study of Religion,video,,Department for the Study of Religion,event;web-cast,video/mp4,,,,,promotional video made by the department ,2023-05-15,2023,,,eng,,,https://youtu.be/jtnk8o5xyWA,https://img.youtube.com/vi/jtnk8o5xyWA/hqdefault.jpg,https://img.youtube.com/vi/jtnk8o5xyWA/hqdefault.jpg
reading_analysis_1,,Course reading heat map,image,scholar69,Albert Yang,Image;StillImage,'image/jpeg',,,,,pie chart of weighting of topics based on assigned weekly readings from 1976-77 and 1987-88 syllabus,2024-05-16,2024,,,eng,,reading_percentage.jpg,/objects/reading_percentage.jpg,/objects/small/reading_percentage_sm.jpg,/objects/thumbs/reading_percentage_th.jpg